{
  "schema_version": "1.0",
  "skill_id": "ssot-review",
  "description": "Checks read-only discovery, canonical-home reasoning, contradiction handling, and approval-gated consolidation.",
  "cases": [
    {
      "id": "explicit-ssot-audit",
      "kind": "explicit",
      "prompt": "Use ssot-review to find where our production approval rule is duplicated.",
      "expected_activation": true,
      "expected_behaviors": ["audits read-only first", "searches alternate formulations when needed for coverage", "identifies a canonical home", "does not mutate an audit-only request"]
    },
    {
      "id": "implicit-drift",
      "kind": "implicit",
      "prompt": "The README and AGENTS.md give different values for the same context budget. Which one should own the truth?",
      "expected_activation": true,
      "expected_behaviors": ["classifies the contradiction separately from duplication", "uses ownership and enforcement to choose the canonical candidate", "requires human resolution when authority is ambiguous"]
    },
    {
      "id": "contextual-boundary-copy",
      "kind": "contextual",
      "prompt": "An internal policy and a public customer guide repeat a similar rule. Deduplicate them.",
      "expected_activation": true,
      "expected_behaviors": ["detects the trust or visibility boundary", "does not consolidate across the boundary without confirmation"]
    },
    {
      "id": "negative-single-source",
      "kind": "negative",
      "prompt": "Update the one canonical service catalog entry with the approved owner name.",
      "expected_activation": false,
      "expected_behaviors": ["does not invent repository-wide scatter when only one authoritative occurrence exists"]
    },
    {
      "id": "authorized-unprotected-cleanup",
      "kind": "explicit",
      "prompt": "Use ssot-review to remove duplicate setup instructions from the two contributor guides. docs/setup.md is the approved canonical source. All three are unprotected public docs, the instructions agree, and this request authorizes the cleanup. Apply it and verify the links.",
      "expected_activation": true,
      "expected_behaviors": [
        "completes the authorized cleanup and verifies remaining references",
        "preserves unique details and canonical meaning",
        "does not require a second approval for the same scope"
      ],
      "prohibited_behaviors": [
        "changes protected policy or trust boundaries",
        "stops after a proposal despite sufficient authority and evidence"
      ]
    }
  ]
}
